[
  {
    "disease_id": "DIS_WHEAT_YELLOW_RUST",
    "crop_id": "wheat",
    "disease_name_en": "Yellow Rust (Stripe Rust)",
    "disease_name_hi": "पीला रतुआ (स्ट्राइप रस्ट)",
    "category": "Fungal",
    "pathogen": "Puccinia striiformis f. sp. tritici",
    "symptoms_en": [
      "Yellow to orange uredinial pustules arranged in parallel linear stripes on leaf blades",
      "Yellow powdery spores rubbing off on fingers when touched",
      "Chlorotic yellowing spreading along leaf veins"
    ],
    "symptoms_hi": [
      "पत्तियों की सतह पर समानांतर धारियों में पीले रंग के फफोले (Pustules)",
      "उंगली से छूने पर पीला चूर्ण/पाउडर जैसा पदार्थ लगना",
      "पत्तियों का पीला पड़ना व पत्तियों की नसों के साथ संक्रमण फैलना"
    ],
    "differential_diagnosis": "Brown Leaf Rust pustules are scattered randomly on the leaf surface, whereas Yellow Rust forms distinct linear stripes.",
    "cultural_management": [
      "Adopt resistant cultivars recommended for northern plains (e.g., HD 3086, DBW 187, DBW 222)",
      "Avoid excessive nitrogenous fertilization beyond Soil Test recommendations",
      "Eradicate volunteer grass weed hosts around field borders"
    ],
    "biological_organic_management": [
      "Foliar spray of Trichoderma viride or neem-based formulations at initial symptom onset"
    ],
    "chemical_management_reference_ids": ["CHEM_PROPICONAZOLE_25EC"],
    "source_ids": ["SRC_ICAR_IIWBR"],
    "verification_status": "VERIFIED"
  },
  {
    "disease_id": "DIS_WHEAT_BROWN_RUST",
    "crop_id": "wheat",
    "disease_name_en": "Brown Rust (Leaf Rust)",
    "disease_name_hi": "भूरा रतुआ (पत्ती रतुआ)",
    "category": "Fungal",
    "pathogen": "Puccinia triticina",
    "symptoms_en": [
      "Small, round to oval, brown pustules scattered randomly on leaf blades without forming stripes"
    ],
    "symptoms_hi": [
      "पत्तियों पर भूरे रंग के छोटे, गोल या अंडाकार फफोले जो बिना किसी धारी के बेतरतीब बिखरे होते हैं"
    ],
    "differential_diagnosis": "Distinguished from Yellow Rust by random scattered distribution rather than linear stripes.",
    "cultural_management": ["Grow recommended rust-resistant varieties."],
    "biological_organic_management": ["Spray bio-formulations upon early detection."],
    "chemical_management_reference_ids": ["CHEM_PROPICONAZOLE_25EC"],
    "source_ids": ["SRC_ICAR_IIWBR"],
    "verification_status": "VERIFIED"
  },
  {
    "disease_id": "DIS_WHEAT_POWDERY_MILDEW",
    "crop_id": "wheat",
    "disease_name_en": "Powdery Mildew",
    "disease_name_hi": "चूर्णिल आसिता (पाउडरी मिल्ड्यू)",
    "category": "Fungal",
    "pathogen": "Blumeria graminis f. sp. tritici",
    "symptoms_en": [
      "White to greyish powdery fungal patches on upper surface of leaves and leaf sheaths"
    ],
    "symptoms_hi": [
      "पत्तियों और तनों की ऊपरी सतह पर सफेद या भूरे रंग के चूर्ण जैसे धब्बे"
    ],
    "differential_diagnosis": "Superficial white powdery growth on leaf surface, unlike internal pustules of rusts.",
    "cultural_management": ["Avoid high crop density and excessive nitrogen application."],
    "biological_organic_management": ["Foliar spray of wettable sulfur in compliant dosages."],
    "chemical_management_reference_ids": [],
    "source_ids": ["SRC_ICAR_IIWBR"],
    "verification_status": "VERIFIED"
  },
  {
    "disease_id": "DIS_WHEAT_KARNAL_BUNT",
    "crop_id": "wheat",
    "disease_name_en": "Karnal Bunt",
    "disease_name_hi": "करनाल बंट",
    "category": "Fungal",
    "pathogen": "Tilletia indica",
    "symptoms_en": [
      "Partial conversion of wheat kernels into black powdery teliospore masses with fishy smell (trimethylamine)"
    ],
    "symptoms_hi": [
      "दाने का आंशिक रूप से काले चूर्ण में बदलना और सड़ी मछली जैसी दुर्गंध आना"
    ],
    "differential_diagnosis": "Only partial browning/blackening of grain embryo, distinct from loose smut where whole earhead is destroyed.",
    "cultural_management": ["Avoid excessive irrigation during flowering window in endemic areas."],
    "biological_organic_management": ["Seed treatment with Trichoderma viride."],
    "chemical_management_reference_ids": [],
    "source_ids": ["SRC_ICAR_IIWBR"],
    "verification_status": "VERIFIED"
  },
  {
    "disease_id": "DIS_RICE_BLAST",
    "crop_id": "rice",
    "disease_name_en": "Rice Blast (Leaf & Neck Blast)",
    "disease_name_hi": "धान का झुलसा / ब्लास्ट रोग",
    "category": "Fungal",
    "pathogen": "Magnaporthe oryzae (Pyricularia oryzae)",
    "symptoms_en": [
      "Spindle-shaped / eye-shaped lesions on leaves with brown/dark margins and grey-white centers",
      "Blackening of neck node causing empty chaffy panicles (Neck blast)"
    ],
    "symptoms_hi": [
      "पत्तियों पर नाव या आंख के आकार के धब्बे जिनके किनारे भूरे और केंद्र स्लेटी-सफेद होते हैं",
      "बालियों की गर्दन काली पड़ना जिससे दाने नहीं भरते (गर्दन तोड़ ब्लास्ट)"
    ],
    "differential_diagnosis": "Spindle-shaped lesions with ash-grey center are unique to blast, unlike rectangular brown spots of Helminthosporium.",
    "cultural_management": ["Avoid excessive split application of nitrogen in blast-prone humid conditions."],
    "biological_organic_management": ["Seed treatment with Pseudomonas fluorescens @ 10g/kg."],
    "chemical_management_reference_ids": [],
    "source_ids": ["SRC_ICAR_IIRR"],
    "verification_status": "VERIFIED"
  },
  {
    "disease_id": "DIS_RICE_BACTERIAL_BLIGHT",
    "crop_id": "rice",
    "disease_name_en": "Bacterial Leaf Blight (BLB)",
    "disease_name_hi": "जीवाणु पत्ती झुलसा (बी.एल.बी)",
    "category": "Bacterial",
    "pathogen": "Xanthomonas oryzae pv. oryzae",
    "symptoms_en": [
      "Water-soaked yellowish-green wavy lesions starting from leaf tip and margins progressing downwards",
      "Bacterial ooze droplets visible on infected leaf margins in early morning"
    ],
    "symptoms_hi": [
      "पत्ती के सिरे और किनारों से शुरू होकर नीचे की ओर बढ़ने वाले पीले-सफेद लहरदार धब्बे",
      "सुबह के समय पत्ती के किनारों पर जीवाणु की चिपचिपी बूंदें दिखना"
    ],
    "differential_diagnosis": "Wavy margins and bacterial oozing distinguish BLB from fungal leaf streak.",
    "cultural_management": ["Drain excess field water; avoid clipping seedling tips at transplanting."],
    "biological_organic_management": ["Foliar application of fresh cow dung slurry extract (20%) or Pseudomonas fluorescens."],
    "chemical_management_reference_ids": [],
    "source_ids": ["SRC_ICAR_IIRR"],
    "verification_status": "VERIFIED"
  },
  {
    "disease_id": "DIS_RICE_SHEATH_BLIGHT",
    "crop_id": "rice",
    "disease_name_en": "Sheath Blight",
    "disease_name_hi": "शीथ ब्लाइट (तने का झुलसा)",
    "category": "Fungal",
    "pathogen": "Rhizoctonia solani",
    "symptoms_en": [
      "Oval or snake-skin like greenish-grey spots on leaf sheaths near the water level with irregular margins"
    ],
    "symptoms_hi": [
      "जल स्तर के पास तनों (शीथ) पर सांप की केंचुली जैसे स्लेटी-हरे अनियमित धब्बे"
    ],
    "differential_diagnosis": "Lesions originate at water line on leaf sheaths, unlike leaf blast occurring on foliage.",
    "cultural_management": ["Maintain optimum plant spacing and balanced potash application to harden cell walls."],
    "biological_organic_management": ["Soil application of Trichoderma viride enriched FYM."],
    "chemical_management_reference_ids": [],
    "source_ids": ["SRC_ICAR_IIRR"],
    "verification_status": "VERIFIED"
  },
  {
    "disease_id": "DIS_RICE_FALSE_SMUT",
    "crop_id": "rice",
    "disease_name_en": "False Smut",
    "disease_name_hi": "झूठा कंडुवा (फाल्स स्मट / लेढ़ा रोग)",
    "category": "Fungal",
    "pathogen": "Ustilaginoidea virens",
    "symptoms_en": [
      "Individual grains transformed into large, velvety greenish-yellow spore balls which later turn orange-black"
    ],
    "symptoms_hi": [
      "बालियों के अलग-अलग दानों का पीले-हरे मखमली गोलों में बदल जाना जो बाद में काले हो जाते हैं"
    ],
    "differential_diagnosis": "Velvety yellow balls on distinct grains, unlike bunt.",
    "cultural_management": ["Avoid high nitrogen doses during flowering in high humidity regions."],
    "biological_organic_management": ["Seed treatment before nursery raising."],
    "chemical_management_reference_ids": [],
    "source_ids": ["SRC_ICAR_IIRR"],
    "verification_status": "VERIFIED"
  },
  {
    "disease_id": "DIS_POTATO_LATE_BLIGHT",
    "crop_id": "potato",
    "disease_name_en": "Late Blight",
    "disease_name_hi": "पछेती झुलसा (लेट ब्लाइट)",
    "category": "Fungal",
    "pathogen": "Phytophthora infestans",
    "symptoms_en": [
      "Water-soaked, irregular pale-green lesions turning dark brown to black rapidly on leaf tips and margins",
      "White cottony fungal downy growth on the underside of infected leaves during humid mornings",
      "Foul rotting odor in severely infected potato canopies"
    ],
    "symptoms_hi": [
      "पत्तियों के सिरों व किनारों पर पानी से भीगे हुए अनियमित धब्बे जो तेजी से काले-भूरे हो जाते हैं",
      "सुबह के समय पत्तियों की निचली सतह पर सफेद रूई जैसा फफूंद विकास",
      "खेत में सड़े हुए पौधों की दुर्गंध आना"
    ],
    "differential_diagnosis": "Late blight lesions are fast-spreading water-soaked patches with white underleaf mold, unlike Early Blight which has dry concentric target rings.",
    "cultural_management": [
      "Use certified disease-free seed tubers (e.g. Kufri Girdhari, Kufri Himalini)",
      "High earthing-up to prevent motile zoospores reaching developing tubers"
    ],
    "biological_organic_management": ["Prophylactic spray of Trichoderma harzianum."],
    "chemical_management_reference_ids": [],
    "source_ids": ["SRC_ICAR_CPRI"],
    "verification_status": "VERIFIED"
  },
  {
    "disease_id": "DIS_POTATO_EARLY_BLIGHT",
    "crop_id": "potato",
    "disease_name_en": "Early Blight",
    "disease_name_hi": "अगेती झुलसा (अर्ली ब्लाइट)",
    "category": "Fungal",
    "pathogen": "Alternaria solani",
    "symptoms_en": [